"","x"
"1","the project gutenberg ebook of an"
"2","of the project gutenberg license included with"
"3","online at www gutenberg net title an"
"4","of this project gutenberg ebook an enemy"
"5","of the project gutenberg ebook of an"
"6","of this project gutenberg ebook an enemy"
"7","in http www gutenberg org 2 4"
"8","and distributing project gutenberg tm electronic works"
"9","protect the project gutenberg tm concept and"
"10","and trademark project gutenberg is a registered"
"11","the full project gutenberg license please read"
"12","protect the project gutenberg tm mission of"
"13","the phrase project gutenberg you agree to"
"14","the full project gutenberg tm license available"
"15","online at http gutenberg net license section"
"16","and redistributing project gutenberg tm electronic works"
"17","of this project gutenberg tm electronic work"
"18","copies of project gutenberg tm electronic works"
"19","to a project gutenberg tm electronic work"
"20","1 b project gutenberg is a registered"
"21","with most project gutenberg tm electronic works"
"22","do with project gutenberg tm electronic works"
"23","access to project gutenberg tm electronic works"
"24","c the project gutenberg literary archive foundation"
"25","collection of project gutenberg tm electronic works"
"26","references to project gutenberg are removed of"
"27","support the project gutenberg tm mission of"
"28","freely sharing project gutenberg tm works in"
"29","keeping the project gutenberg tm name associated"
"30","attached full project gutenberg tm license when"
"31","any other project gutenberg tm work the"
"32","references to project gutenberg 1 e 1"
"33","the full project gutenberg tm license must"
"34","of a project gutenberg tm work any"
"35","the phrase project gutenberg appears or with"
"36","the phrase project gutenberg is associated is"
"37","of the project gutenberg license included with"
"38","online at www gutenberg net 1 e"
"39","an individual project gutenberg tm electronic work"
"40","the phrase project gutenberg associated with or"
"41","and the project gutenberg tm trademark as"
"42","an individual project gutenberg tm electronic work"
"43","to the project gutenberg tm license for"
"44","the full project gutenberg tm license terms"
"45","associated with project gutenberg tm 1 e"
"46","of the project gutenberg tm license 1"
"47","of a project gutenberg tm work in"
"48","the official project gutenberg tm web site"
"49","web site www gutenberg net you must"
"50","the full project gutenberg tm license as"
"51","distributing any project gutenberg tm works unless"
"52","or distributing project gutenberg tm electronic works"
"53","use of project gutenberg tm works calculated"
"54","of the project gutenberg tm trademark but"
"55","to the project gutenberg literary archive foundation"
"56","to the project gutenberg literary archive foundation"
"57","to the project gutenberg literary archive foundation"
"58","the full project gutenberg tm license you"
"59","copies of project gutenberg tm works you"
"60","distribution of project gutenberg tm works 1"
"61","distribute a project gutenberg tm electronic work"
"62","both the project gutenberg literary archive foundation"
"63","of the project gutenberg tm trademark contact"
"64","f 1 project gutenberg volunteers and employees"
"65","creating the project gutenberg tm collection despite"
"66","these efforts project gutenberg tm electronic works"
"67","3 the project gutenberg literary archive foundation"
"68","of the project gutenberg tm trademark and"
"69","distributing a project gutenberg tm electronic work"
"70","copies of project gutenberg tm electronic works"
"71","distribution of project gutenberg tm electronic works"
"72","or any project gutenberg tm work b"
"73","to any project gutenberg tm work and"
"74","mission of project gutenberg tm project gutenberg"
"75","gutenberg tm project gutenberg tm is synonymous"
"76","to reaching project gutenberg tm s goals"
"77","that the project gutenberg tm collection will"
"78","2001 the project gutenberg literary archive foundation"
"79","future for project gutenberg tm and future"
"80","about the project gutenberg literary archive foundation"
"81","about the project gutenberg literary archive foundation"
"82","foundation the project gutenberg literary archive foundation"
"83","to the project gutenberg literary archive foundation"
"84","to the project gutenberg literary archive foundation"
"85","archive foundation project gutenberg tm depends upon"
"86","check the project gutenberg web pages for"
"87","information about project gutenberg tm electronic works"
"88","of the project gutenberg tm concept of"
"89","and distributed project gutenberg tm ebooks with"
"90","volunteer support project gutenberg tm ebooks are"
"91","facility http www gutenberg net this web"
"92","information about project gutenberg tm including how"
"93","to the project gutenberg literary archive foundation"
